{
  "$id": "https://github.com/SolusQuest/contract-scribe/schemas/validation/m1-host-validation-network-evidence-profile-v1.schema.json",
  "$schema": "https://json-schema.org/draft/2020-12/schema",
  "additionalProperties": false,
  "properties": {
    "claimSetId": {
      "const": "m1.network-behavior-and-bounded-evidence-claims.v1"
    },
    "coveredSourceIndirections": {
      "const": [
        "Activator.CreateInstance",
        "Assembly.GetType",
        "Assembly.Load",
        "AssemblyLoadContext",
        "Delegate.CreateDelegate",
        "Expression.Compile",
        "Marshal.GetDelegateForFunctionPointer",
        "MethodBase.Invoke",
        "NativeLibrary",
        "Type.GetConstructors",
        "Type.GetMethod",
        "Type.GetMethods",
        "Type.GetType",
        "dynamic",
        "unmanaged-function-pointer"
      ]
    },
    "formatVersion": {
      "const": "contractscribe-m1-host-validation-network-evidence-profile-v1"
    },
    "methods": {
      "const": [
        {
          "coverageLimitationId": "declared-operations-and-protected-dependencies.v1",
          "methodId": "declared-dependency-and-operation-inventory",
          "methodVersion": 1
        },
        {
          "coverageLimitationId": "explicit-source-metadata-route-regressions.v1",
          "methodId": "bounded-source-and-managed-metadata-regression-scan",
          "methodVersion": 1
        },
        {
          "coverageLimitationId": "product-owned-operation-seams.v1",
          "methodId": "test-operation-recorder",
          "methodVersion": 1
        },
        {
          "coverageLimitationId": "synchronized-process-and-protected-artifact-observation.v1",
          "methodId": "restore-runtime-download-process-artifact-observer",
          "methodVersion": 1
        }
      ]
    },
    "profileId": {
      "const": "m1.bounded-exact-revision-network-conformance.v1"
    },
    "recorderActivationRecord": {
      "const": "{\"formatVersion\":\"contractscribe-network-operation-recorder-v1\",\"state\":\"active\"}"
    }
  },
  "required": [
    "claimSetId",
    "coveredSourceIndirections",
    "formatVersion",
    "methods",
    "profileId",
    "recorderActivationRecord"
  ],
  "type": "object"
}
