{
  "claimSetId": "m1.network-behavior-and-bounded-evidence-claims.v1",
  "coveredSourceIndirections": [
    "Activator.CreateInstance",
    "Assembly.GetType",
    "Assembly.Load",
    "AssemblyLoadContext",
    "Delegate.CreateDelegate",
    "Expression.Compile",
    "Marshal.GetDelegateForFunctionPointer",
    "MethodBase.Invoke",
    "NativeLibrary",
    "Type.GetConstructors",
    "Type.GetMethod",
    "Type.GetMethods",
    "Type.GetType",
    "dynamic",
    "unmanaged-function-pointer"
  ],
  "formatVersion": "contractscribe-m1-host-validation-network-evidence-profile-v1",
  "methods": [
    {
      "coverageLimitationId": "declared-operations-and-protected-dependencies.v1",
      "methodId": "declared-dependency-and-operation-inventory",
      "methodVersion": 1
    },
    {
      "coverageLimitationId": "explicit-source-metadata-route-regressions.v1",
      "methodId": "bounded-source-and-managed-metadata-regression-scan",
      "methodVersion": 1
    },
    {
      "coverageLimitationId": "product-owned-operation-seams.v1",
      "methodId": "test-operation-recorder",
      "methodVersion": 1
    },
    {
      "coverageLimitationId": "synchronized-process-and-protected-artifact-observation.v1",
      "methodId": "restore-runtime-download-process-artifact-observer",
      "methodVersion": 1
    }
  ],
  "profileId": "m1.bounded-exact-revision-network-conformance.v1",
  "recorderActivationRecord": "{\"formatVersion\":\"contractscribe-network-operation-recorder-v1\",\"state\":\"active\"}"
}
